{"assets":[{"path":"data/aas-v1/skill-content-index.v1.json","sha256":"sha256-d6118c6e0f503dc3769863d52fd122e023344ab9217725ed1eb0dddcb7bf1cce","size":1407925},{"path":"data/aas-v1/skill-content.v1.ndjson","sha256":"sha256-90f2a96e0432f49a31d24f9a5ffaf7ddde7395ca93e2c6be835a8f18e7d3d0a7","size":16176117},{"path":"data/catalog.json","sha256":"sha256-d847a0307cceaf6023511779c6a7d160524b6115aa4a910be198bb604f3af2df","size":1765317},{"path":"tools/lib/aas-v1/ontology.v1.json","sha256":"sha256-aaecc6a7e1b5fc7d1f8d5577b797982974aca2642e2d716e05fa2aab6a4fa885","size":7221}],"catalogDigest":"sha256-ab6135e507264d0237f48757eb0440d570850aac4a252e2e001bc6574a5af13c","catalogSchemaVersion":"2.0.0","digestVersion":1,"package":"agentic-awesome-skills","packageVersion":"17.1.0","schemaVersion":1,"skillCount":2121}
